id,name,description,currency,amount
240,pellentesque ultrices mattis,In sagittis dui vel nisl. Duis ac nibh.,PHP,42.02
241,habitasse platea,Nulla suscipit ligula in lacus.,CNY,62.67
242,tincidunt,"Nam congue, risus semper porta volutpat, quam pede lobortis ligula, sit amet eleifend pede libero quis orci.",BYR,18.93
243,praesent blandit nam,Suspendisse potenti.,EUR,30.24
244,consequat dui nec nisi,"Nulla neque libero, convallis eget, eleifend luctus, ultricies eu, nibh.",EUR,97.18
245,imperdiet,"Lorem ipsum dolor sit amet, consectetuer adipiscing elit.",IDR,67.21
246,cubilia curae donec pharetra,Duis consequat dui nec nisi volutpat eleifend. Donec ut dolor. Morbi vel lectus in quam fringilla rhoncus.,IDR,71.08
247,ultrices mattis odio,Morbi non lectus. Aliquam sit amet diam in magna bibendum imperdiet.,CNY,68.6
248,aliquam non,"Pellentesque ultrices mattis odio. Donec vitae nisi. Nam ultrices, libero non mattis pulvinar, nulla pede ullamcorper augue, a suscipit nulla elit ac nulla.",SEK,50.25
249,mauris lacinia sapien,In hac habitasse platea dictumst.,IDR,54.99
250,vestibulum,In quis justo. Maecenas rhoncus aliquam lacus.,BAM,34.81
251,in hac habitasse platea,Nulla mollis molestie lorem. Quisque ut erat.,EUR,5.3
252,aliquam,Duis consequat dui nec nisi volutpat eleifend.,PLN,48.59
253,integer,"Suspendisse potenti. Cras in purus eu magna vulputate luctus. Cum sociis natoque penatibus et magnis dis parturient montes, nascetur ridiculus mus.",SEK,65.41
254,sem,"Cras in purus eu magna vulputate luctus. Cum sociis natoque penatibus et magnis dis parturient montes, nascetur ridiculus mus.",PHP,18.84
255,viverra eget congue,Nulla ut erat id mauris vulputate elementum. Nullam varius. Nulla facilisi.,CUP,30.95
256,pede morbi porttitor,Suspendisse accumsan tortor quis turpis. Sed ante.,JPY,25.59
257,amet,Nunc purus.,PHP,85.14
258,ultrices,"Fusce lacus purus, aliquet at, feugiat non, pretium quis, lectus. Suspendisse potenti.",PLN,53.15
259,sem,"Phasellus id sapien in sapien iaculis congue. Vivamus metus arcu, adipiscing molestie, hendrerit at, vulputate vitae, nisl.",PLN,54.75
260,ut at dolor,Vestibulum ante ipsum primis in faucibus orci luctus et ultrices posuere cubilia Curae; Duis faucibus accumsan odio. Curabitur convallis.,MXN,63.17
261,sit amet eros,"Nunc nisl. Duis bibendum, felis sed interdum venenatis, turpis enim blandit mi, in porttitor pede justo eu massa.",CNY,71.53
262,sagittis nam,Mauris sit amet eros. Suspendisse accumsan tortor quis turpis. Sed ante.,EUR,74.85
263,sed magna at nunc,Vivamus in felis eu sapien cursus vestibulum.,CNY,8.85
264,id luctus nec,Phasellus sit amet erat. Nulla tempus. Vivamus in felis eu sapien cursus vestibulum.,NGN,13.96
265,curabitur convallis duis,Donec posuere metus vitae ipsum.,NOK,40.91
266,in imperdiet,"Vestibulum quam sapien, varius ut, blandit non, interdum in, ante.",IDR,4.28
267,duis consequat dui nec,Mauris sit amet eros. Suspendisse accumsan tortor quis turpis. Sed ante.,EUR,88.95
268,enim in tempor turpis,Quisque id justo sit amet sapien dignissim vestibulum.,THB,43.5
269,praesent blandit,Duis at velit eu est congue elementum.,TTD,36.15
270,maecenas pulvinar lobortis est,In quis justo. Maecenas rhoncus aliquam lacus. Morbi quis tortor id nulla ultrices aliquet.,UAH,52.41
271,velit vivamus vel nulla,"Quisque porta volutpat erat. Quisque erat eros, viverra eget, congue eget, semper rutrum, nulla. Nunc purus.",BOB,13.01
272,vivamus,Praesent id massa id nisl venenatis lacinia.,IDR,44.05
273,in faucibus,Nullam sit amet turpis elementum ligula vehicula consequat. Morbi a ipsum.,SYP,34.84
274,lorem,Maecenas rhoncus aliquam lacus. Morbi quis tortor id nulla ultrices aliquet.,IDR,2.26
275,ante vivamus tortor,Vestibulum sed magna at nunc commodo placerat. Praesent blandit.,PHP,98.09
276,tristique tortor eu pede,Donec ut dolor. Morbi vel lectus in quam fringilla rhoncus.,CNY,20.4
277,lectus,"Morbi vestibulum, velit id pretium iaculis, diam erat fermentum justo, nec condimentum neque sapien placerat ante.",PAB,17.19
278,vel,Etiam vel augue. Vestibulum rutrum rutrum neque. Aenean auctor gravida sem.,MMK,8.41
279,phasellus,Curabitur at ipsum ac tellus semper interdum. Mauris ullamcorper purus sit amet nulla.,CUP,50.71
280,dui maecenas tristique est,In quis justo. Maecenas rhoncus aliquam lacus.,EUR,32.67
281,vel accumsan tellus,Vestibulum rutrum rutrum neque. Aenean auctor gravida sem.,PLN,8.67
282,mauris laoreet ut,"Fusce lacus purus, aliquet at, feugiat non, pretium quis, lectus.",CNY,92.18
283,a nibh,Duis bibendum. Morbi non quam nec dui luctus rutrum. Nulla tellus.,MNT,70.5
284,pretium quis lectus suspendisse,"Quisque arcu libero, rutrum ac, lobortis vel, dapibus at, diam. Nam tristique tortor eu pede.",CNY,47.48
285,vestibulum sit amet cursus,"Nam dui. Proin leo odio, porttitor id, consequat in, consequat ut, nulla. Sed accumsan felis.",SEK,96.07
286,tempus semper est quam,"Morbi odio odio, elementum eu, interdum eu, tincidunt in, leo. Maecenas pulvinar lobortis est.",IDR,59.88
287,posuere,"Aenean fermentum. Donec ut mauris eget massa tempor convallis. Nulla neque libero, convallis eget, eleifend luctus, ultricies eu, nibh.",IDR,3.13
288,ullamcorper augue a,"Maecenas tristique, est et tempus semper, est quam pharetra magna, ac consequat metus sapien ut nunc. Vestibulum ante ipsum primis in faucibus orci luctus et ultrices posuere cubilia Curae; Mauris viverra diam vitae quam.",CNY,73.27
289,in,"Morbi vestibulum, velit id pretium iaculis, diam erat fermentum justo, nec condimentum neque sapien placerat ante. Nulla justo. Aliquam quis turpis eget elit sodales scelerisque.",CNY,56.07
290,in lacus,Nunc rhoncus dui vel sem. Sed sagittis.,IDR,18.44
291,est phasellus sit amet,Vestibulum ante ipsum primis in faucibus orci luctus et ultrices posuere cubilia Curae; Duis faucibus accumsan odio. Curabitur convallis.,AMD,58.81
292,vel nisl duis,"Nam ultrices, libero non mattis pulvinar, nulla pede ullamcorper augue, a suscipit nulla elit ac nulla.",JPY,74.05
293,phasellus in felis donec,"Donec semper sapien a libero. Nam dui. Proin leo odio, porttitor id, consequat in, consequat ut, nulla.",PEN,27.78
294,interdum mauris non ligula,"Aliquam augue quam, sollicitudin vitae, consectetuer eget, rutrum at, lorem. Integer tincidunt ante vel ipsum.",IDR,24.64
295,in est risus,"Cras pellentesque volutpat dui. Maecenas tristique, est et tempus semper, est quam pharetra magna, ac consequat metus sapien ut nunc. Vestibulum ante ipsum primis in faucibus orci luctus et ultrices posuere cubilia Curae; Mauris viverra diam vitae quam.",CNY,82.16
296,in faucibus,Aenean auctor gravida sem. Praesent id massa id nisl venenatis lacinia.,MNT,51.93
297,turpis eget,Nullam sit amet turpis elementum ligula vehicula consequat. Morbi a ipsum. Integer a nibh.,CNY,30.15
298,sollicitudin vitae,"Vivamus metus arcu, adipiscing molestie, hendrerit at, vulputate vitae, nisl.",EUR,78.08
299,sed,Nullam porttitor lacus at turpis. Donec posuere metus vitae ipsum.,JPY,96.49
300,interdum venenatis turpis,Maecenas rhoncus aliquam lacus.,BYR,56.34
301,fusce posuere felis sed,Pellentesque viverra pede ac diam. Cras pellentesque volutpat dui.,CNY,23.21
302,ipsum,Suspendisse potenti. In eleifend quam a odio. In hac habitasse platea dictumst.,EUR,14.1
303,libero ut massa,Suspendisse accumsan tortor quis turpis. Sed ante. Vivamus tortor.,RUB,58.58
304,pede posuere nonummy integer,"In tempor, turpis nec euismod scelerisque, quam turpis adipiscing lorem, vitae mattis nibh ligula nec sem.",CNY,11.76
305,non velit,Suspendisse potenti. Cras in purus eu magna vulputate luctus.,JPY,92.46
306,faucibus orci luctus,"Praesent lectus. Vestibulum quam sapien, varius ut, blandit non, interdum in, ante. Vestibulum ante ipsum primis in faucibus orci luctus et ultrices posuere cubilia Curae; Duis faucibus accumsan odio.",ARS,81.28
307,suscipit a,"Morbi vestibulum, velit id pretium iaculis, diam erat fermentum justo, nec condimentum neque sapien placerat ante. Nulla justo.",PHP,31.89
308,mi pede malesuada in,"Donec odio justo, sollicitudin ut, suscipit a, feugiat et, eros. Vestibulum ac est lacinia nisi venenatis tristique.",EUR,88.9
309,augue,"Mauris ullamcorper purus sit amet nulla. Quisque arcu libero, rutrum ac, lobortis vel, dapibus at, diam. Nam tristique tortor eu pede.",EUR,89.9
310,etiam justo etiam,"Lorem ipsum dolor sit amet, consectetuer adipiscing elit.",CLP,80.64
311,mauris enim leo rhoncus,"Maecenas leo odio, condimentum id, luctus nec, molestie sed, justo. Pellentesque viverra pede ac diam.",CNY,65.57
312,dictumst aliquam,"Quisque erat eros, viverra eget, congue eget, semper rutrum, nulla. Nunc purus. Phasellus in felis.",LTL,9.96
313,congue diam,"Mauris enim leo, rhoncus sed, vestibulum sit amet, cursus id, turpis.",PHP,33.07
314,dictumst maecenas ut massa,"Nam nulla. Integer pede justo, lacinia eget, tincidunt eget, tempus vel, pede.",CNY,75.68
315,libero nullam sit amet,"Donec odio justo, sollicitudin ut, suscipit a, feugiat et, eros. Vestibulum ac est lacinia nisi venenatis tristique. Fusce congue, diam id ornare imperdiet, sapien urna pretium nisl, ut volutpat sapien arcu sed augue.",CNY,67.07
316,porttitor lorem id,Morbi vel lectus in quam fringilla rhoncus.,NOK,70.93
317,justo nec condimentum,"Morbi odio odio, elementum eu, interdum eu, tincidunt in, leo. Maecenas pulvinar lobortis est.",KMF,57.87
318,vel,"Nulla nisl. Nunc nisl. Duis bibendum, felis sed interdum venenatis, turpis enim blandit mi, in porttitor pede justo eu massa.",XOF,9.87
319,dignissim vestibulum,Sed ante. Vivamus tortor.,MXN,51.38
320,purus aliquet,Pellentesque at nulla. Suspendisse potenti.,PHP,14.71
321,eros,Pellentesque eget nunc. Donec quis orci eget orci vehicula condimentum.,CNY,46.27
322,lorem id ligula suspendisse,Nulla facilisi.,PHP,13.47
323,varius nulla facilisi cras,In quis justo. Maecenas rhoncus aliquam lacus.,IDR,63.54
324,eu nibh quisque id,"Nulla ac enim. In tempor, turpis nec euismod scelerisque, quam turpis adipiscing lorem, vitae mattis nibh ligula nec sem. Duis aliquam convallis nunc.",EUR,56.49
325,odio,In hac habitasse platea dictumst. Etiam faucibus cursus urna. Ut tellus.,RUB,75.91
326,quis orci eget orci,Mauris sit amet eros.,IDR,80.5
327,curae nulla dapibus dolor,In eleifend quam a odio. In hac habitasse platea dictumst.,BRL,94.28
328,imperdiet et commodo,In sagittis dui vel nisl.,PLN,86.55
329,nullam varius nulla,Curabitur gravida nisi at nibh. In hac habitasse platea dictumst.,CNY,78.81
330,vestibulum aliquet,Suspendisse ornare consequat lectus.,CNY,8.29
331,pretium iaculis justo,Aenean lectus. Pellentesque eget nunc. Donec quis orci eget orci vehicula condimentum.,ARS,84.41
332,justo in hac,Aliquam quis turpis eget elit sodales scelerisque. Mauris sit amet eros.,USD,52.58
333,nulla sed,Duis bibendum. Morbi non quam nec dui luctus rutrum.,EUR,86.22
334,interdum eu,Suspendisse potenti. Nullam porttitor lacus at turpis. Donec posuere metus vitae ipsum.,IDR,86.49
335,at velit vivamus vel,"Morbi odio odio, elementum eu, interdum eu, tincidunt in, leo. Maecenas pulvinar lobortis est. Phasellus sit amet erat.",GEL,93.7
336,eget rutrum at lorem,Mauris lacinia sapien quis libero. Nullam sit amet turpis elementum ligula vehicula consequat. Morbi a ipsum.,IDR,98.21
337,felis,"Nam ultrices, libero non mattis pulvinar, nulla pede ullamcorper augue, a suscipit nulla elit ac nulla. Sed vel enim sit amet nunc viverra dapibus.",IDR,34.07
338,tempus,"Pellentesque viverra pede ac diam. Cras pellentesque volutpat dui. Maecenas tristique, est et tempus semper, est quam pharetra magna, ac consequat metus sapien ut nunc.",EUR,9.27
339,vulputate,Nunc nisl.,EUR,5.06
340,lacus,Nunc purus. Phasellus in felis.,BAM,80.69
341,in quam fringilla,"Mauris ullamcorper purus sit amet nulla. Quisque arcu libero, rutrum ac, lobortis vel, dapibus at, diam. Nam tristique tortor eu pede.",RUB,11.23
342,pede justo,Sed vel enim sit amet nunc viverra dapibus. Nulla suscipit ligula in lacus. Curabitur at ipsum ac tellus semper interdum.,MWK,22.01
343,justo in blandit,"Suspendisse potenti. Cras in purus eu magna vulputate luctus. Cum sociis natoque penatibus et magnis dis parturient montes, nascetur ridiculus mus.",CNY,32.05
344,in felis eu sapien,"Cum sociis natoque penatibus et magnis dis parturient montes, nascetur ridiculus mus.",PHP,55.04
345,eget nunc donec,Etiam justo. Etiam pretium iaculis justo.,EUR,69.5
346,pretium iaculis justo in,Aliquam quis turpis eget elit sodales scelerisque.,CNY,59.11
347,odio odio elementum,"Quisque arcu libero, rutrum ac, lobortis vel, dapibus at, diam. Nam tristique tortor eu pede.",XOF,16.92
348,eros suspendisse,"Fusce posuere felis sed lacus. Morbi sem mauris, laoreet ut, rhoncus aliquet, pulvinar sed, nisl. Nunc rhoncus dui vel sem.",VND,57.03
349,eget semper,In eleifend quam a odio.,RUB,30.35
350,accumsan tortor quis turpis,In congue. Etiam justo.,CNY,15.06
351,arcu,Nulla facilisi. Cras non velit nec nisi vulputate nonummy.,PHP,48.42
352,ullamcorper purus sit,Maecenas ut massa quis augue luctus tincidunt. Nulla mollis molestie lorem.,CNY,35.05
353,id nisl,"Donec vitae nisi. Nam ultrices, libero non mattis pulvinar, nulla pede ullamcorper augue, a suscipit nulla elit ac nulla. Sed vel enim sit amet nunc viverra dapibus.",CNY,95.24
354,tellus nulla ut erat,"In hac habitasse platea dictumst. Aliquam augue quam, sollicitudin vitae, consectetuer eget, rutrum at, lorem.",EUR,86.82
355,ac diam cras,"Vestibulum ac est lacinia nisi venenatis tristique. Fusce congue, diam id ornare imperdiet, sapien urna pretium nisl, ut volutpat sapien arcu sed augue. Aliquam erat volutpat.",ILS,57.29
356,ac lobortis vel dapibus,Duis consequat dui nec nisi volutpat eleifend.,AFN,48.13
357,odio condimentum,Maecenas tincidunt lacus at velit.,PHP,61.86
358,pede lobortis,"Quisque arcu libero, rutrum ac, lobortis vel, dapibus at, diam. Nam tristique tortor eu pede.",EUR,75.5
359,augue vel,Nulla justo. Aliquam quis turpis eget elit sodales scelerisque. Mauris sit amet eros.,CLP,98.65
360,eget tincidunt eget tempus,Fusce consequat.,CZK,15.37
361,vel dapibus at,"Maecenas tristique, est et tempus semper, est quam pharetra magna, ac consequat metus sapien ut nunc. Vestibulum ante ipsum primis in faucibus orci luctus et ultrices posuere cubilia Curae; Mauris viverra diam vitae quam. Suspendisse potenti.",EUR,12.3
362,nunc vestibulum ante ipsum,"Nulla ac enim. In tempor, turpis nec euismod scelerisque, quam turpis adipiscing lorem, vitae mattis nibh ligula nec sem.",MXN,24.32
363,curae donec pharetra,"Duis ac nibh. Fusce lacus purus, aliquet at, feugiat non, pretium quis, lectus. Suspendisse potenti.",EUR,51.57
364,enim,Morbi a ipsum. Integer a nibh.,CNY,56.05
365,integer ac,"Maecenas tristique, est et tempus semper, est quam pharetra magna, ac consequat metus sapien ut nunc.",EUR,29.43
366,vel ipsum praesent,Morbi a ipsum. Integer a nibh. In quis justo.,KGS,90.39
367,leo pellentesque ultrices mattis,Donec ut mauris eget massa tempor convallis.,BRL,65.63
368,posuere metus,"Sed sagittis. Nam congue, risus semper porta volutpat, quam pede lobortis ligula, sit amet eleifend pede libero quis orci. Nullam molestie nibh in lectus.",XOF,35.57
369,dui maecenas,Duis mattis egestas metus. Aenean fermentum.,IDR,96.57
370,pellentesque ultrices mattis odio,"Quisque arcu libero, rutrum ac, lobortis vel, dapibus at, diam.",RUB,17.81
371,tellus semper interdum mauris,Ut at dolor quis odio consequat varius. Integer ac leo.,PEN,30.41
372,lorem,Suspendisse potenti. Cras in purus eu magna vulputate luctus.,RUB,23.73
373,ante ipsum primis,"Morbi ut odio. Cras mi pede, malesuada in, imperdiet et, commodo vulputate, justo.",CNY,53.86
374,ut mauris,Duis at velit eu est congue elementum. In hac habitasse platea dictumst.,MXN,84.45
375,suscipit a feugiat et,"Lorem ipsum dolor sit amet, consectetuer adipiscing elit.",BGN,66.12
376,nulla nunc,Duis consequat dui nec nisi volutpat eleifend. Donec ut dolor. Morbi vel lectus in quam fringilla rhoncus.,PLN,44.66
377,montes nascetur ridiculus mus,Aenean lectus.,IDR,86.61
378,arcu libero rutrum ac,"Quisque arcu libero, rutrum ac, lobortis vel, dapibus at, diam.",USD,55.46
379,ultrices vel augue vestibulum,Vivamus in felis eu sapien cursus vestibulum.,JPY,73.59
380,ac diam,Mauris sit amet eros. Suspendisse accumsan tortor quis turpis. Sed ante.,DOP,81.6
381,gravida,Donec quis orci eget orci vehicula condimentum. Curabitur in libero ut massa volutpat convallis.,AZN,32.27
382,sed justo pellentesque viverra,"Duis bibendum, felis sed interdum venenatis, turpis enim blandit mi, in porttitor pede justo eu massa. Donec dapibus.",PHP,5.9
383,vulputate,In hac habitasse platea dictumst.,USD,36.27
384,leo maecenas pulvinar,"Fusce lacus purus, aliquet at, feugiat non, pretium quis, lectus.",CNY,59.39
385,non lectus aliquam,"In tempor, turpis nec euismod scelerisque, quam turpis adipiscing lorem, vitae mattis nibh ligula nec sem. Duis aliquam convallis nunc.",PHP,64.9
386,elementum pellentesque,Mauris sit amet eros. Suspendisse accumsan tortor quis turpis. Sed ante.,AZN,55.81
387,hac habitasse platea dictumst,"Lorem ipsum dolor sit amet, consectetuer adipiscing elit. Proin interdum mauris non ligula pellentesque ultrices. Phasellus id sapien in sapien iaculis congue.",EUR,54.38
388,quis libero nullam sit,"Curabitur at ipsum ac tellus semper interdum. Mauris ullamcorper purus sit amet nulla. Quisque arcu libero, rutrum ac, lobortis vel, dapibus at, diam.",DOP,25.47
389,donec dapibus,"In hac habitasse platea dictumst. Aliquam augue quam, sollicitudin vitae, consectetuer eget, rutrum at, lorem. Integer tincidunt ante vel ipsum.",LRD,38.74
390,fringilla rhoncus mauris,Nulla suscipit ligula in lacus. Curabitur at ipsum ac tellus semper interdum. Mauris ullamcorper purus sit amet nulla.,AMD,56.03
391,amet,"Lorem ipsum dolor sit amet, consectetuer adipiscing elit. Proin risus.",CAD,27.91
392,scelerisque mauris,Morbi non lectus. Aliquam sit amet diam in magna bibendum imperdiet.,IDR,89.54
393,vel nisl duis,Praesent id massa id nisl venenatis lacinia. Aenean sit amet justo.,CNY,74.2
394,commodo vulputate justo,Sed vel enim sit amet nunc viverra dapibus. Nulla suscipit ligula in lacus.,COP,7.52
395,purus,Nulla facilisi. Cras non velit nec nisi vulputate nonummy.,USD,45.02
396,imperdiet sapien urna pretium,Duis consequat dui nec nisi volutpat eleifend. Donec ut dolor. Morbi vel lectus in quam fringilla rhoncus.,ILS,4.62
397,sit,Donec vitae nisi.,UAH,73.07
398,at lorem,"In tempor, turpis nec euismod scelerisque, quam turpis adipiscing lorem, vitae mattis nibh ligula nec sem.",IDR,38.42
399,habitasse platea dictumst morbi,"Quisque id justo sit amet sapien dignissim vestibulum. Vestibulum ante ipsum primis in faucibus orci luctus et ultrices posuere cubilia Curae; Nulla dapibus dolor vel est. Donec odio justo, sollicitudin ut, suscipit a, feugiat et, eros.",CNY,64.58
400,cras mi pede malesuada,Maecenas ut massa quis augue luctus tincidunt.,CLP,84.82
401,ridiculus mus vivamus,Aliquam quis turpis eget elit sodales scelerisque. Mauris sit amet eros.,DOP,82.83
402,ut tellus nulla ut,Nulla facilisi. Cras non velit nec nisi vulputate nonummy.,CNY,15.24
403,vitae,Donec ut dolor.,HRK,6.5
404,in,Nulla nisl.,BRL,78.96
405,interdum mauris ullamcorper purus,"In est risus, auctor sed, tristique in, tempus sit amet, sem. Fusce consequat.",BRL,70.61
406,vulputate,"Fusce lacus purus, aliquet at, feugiat non, pretium quis, lectus. Suspendisse potenti.",IDR,48.3
407,odio donec vitae nisi,Aliquam quis turpis eget elit sodales scelerisque.,BGN,64.61
408,penatibus et magnis,"Nam nulla. Integer pede justo, lacinia eget, tincidunt eget, tempus vel, pede.",RUB,33.3
409,tempus vel pede morbi,Vestibulum ante ipsum primis in faucibus orci luctus et ultrices posuere cubilia Curae; Nulla dapibus dolor vel est.,USD,86.74
410,nisi,"Vestibulum ante ipsum primis in faucibus orci luctus et ultrices posuere cubilia Curae; Nulla dapibus dolor vel est. Donec odio justo, sollicitudin ut, suscipit a, feugiat et, eros.",CNY,76.11
411,nisi venenatis tristique fusce,In quis justo. Maecenas rhoncus aliquam lacus. Morbi quis tortor id nulla ultrices aliquet.,BRL,20.24
412,semper porta,Nam dui.,CRC,12.51
413,in,Morbi non lectus.,KHR,5.59
414,condimentum,Integer tincidunt ante vel ipsum.,MGA,93.7
415,at turpis a pede,"Sed sagittis. Nam congue, risus semper porta volutpat, quam pede lobortis ligula, sit amet eleifend pede libero quis orci.",CNY,87.07
416,venenatis lacinia,Maecenas ut massa quis augue luctus tincidunt. Nulla mollis molestie lorem. Quisque ut erat.,EUR,26.94
417,ipsum primis in faucibus,"Mauris ullamcorper purus sit amet nulla. Quisque arcu libero, rutrum ac, lobortis vel, dapibus at, diam. Nam tristique tortor eu pede.",IDR,28.34
418,massa quis augue luctus,Aliquam quis turpis eget elit sodales scelerisque. Mauris sit amet eros. Suspendisse accumsan tortor quis turpis.,CNY,25.2
419,ac,Nunc nisl.,CNY,17.81
420,quis,Morbi vel lectus in quam fringilla rhoncus.,SEK,2.71
421,mauris viverra,"Donec ut mauris eget massa tempor convallis. Nulla neque libero, convallis eget, eleifend luctus, ultricies eu, nibh. Quisque id justo sit amet sapien dignissim vestibulum.",PHP,33.99
422,at,Vivamus in felis eu sapien cursus vestibulum. Proin eu mi. Nulla ac enim.,CNY,17.8
423,ornare,"Morbi ut odio. Cras mi pede, malesuada in, imperdiet et, commodo vulputate, justo. In blandit ultrices enim.",IRR,90.52
424,gravida sem,Praesent id massa id nisl venenatis lacinia.,UAH,72.94
425,pede morbi,"Curabitur in libero ut massa volutpat convallis. Morbi odio odio, elementum eu, interdum eu, tincidunt in, leo.",RUB,85.24
426,commodo,Maecenas rhoncus aliquam lacus. Morbi quis tortor id nulla ultrices aliquet.,EUR,42.26
427,nunc nisl duis bibendum,"Maecenas tristique, est et tempus semper, est quam pharetra magna, ac consequat metus sapien ut nunc. Vestibulum ante ipsum primis in faucibus orci luctus et ultrices posuere cubilia Curae; Mauris viverra diam vitae quam.",BRL,51.19
428,in,Nulla tellus. In sagittis dui vel nisl.,IDR,42.52
429,at nibh in hac,In eleifend quam a odio. In hac habitasse platea dictumst. Maecenas ut massa quis augue luctus tincidunt.,RUB,22.15
430,maecenas leo,Donec quis orci eget orci vehicula condimentum. Curabitur in libero ut massa volutpat convallis.,SEK,64.97
431,sit amet eleifend pede,"Cras pellentesque volutpat dui. Maecenas tristique, est et tempus semper, est quam pharetra magna, ac consequat metus sapien ut nunc.",USD,13.09
432,gravida nisi,Nulla nisl. Nunc nisl.,LTL,18.9
433,eu mi,"Donec ut dolor. Morbi vel lectus in quam fringilla rhoncus. Mauris enim leo, rhoncus sed, vestibulum sit amet, cursus id, turpis.",CNY,31.33
434,in magna,Nullam varius. Nulla facilisi. Cras non velit nec nisi vulputate nonummy.,SEK,67.58
435,pretium,Proin risus. Praesent lectus.,UAH,58.99
436,dolor morbi,In hac habitasse platea dictumst.,SEK,70.1
437,donec,"Nullam orci pede, venenatis non, sodales sed, tincidunt eu, felis. Fusce posuere felis sed lacus.",EUR,90.25
438,ante ipsum primis,Fusce consequat. Nulla nisl.,RUB,37.33
439,elementum nullam varius,In quis justo. Maecenas rhoncus aliquam lacus. Morbi quis tortor id nulla ultrices aliquet.,BAM,36.01
440,ligula nec sem duis,Integer tincidunt ante vel ipsum. Praesent blandit lacinia erat.,CNY,34.94
441,vestibulum,"Integer pede justo, lacinia eget, tincidunt eget, tempus vel, pede. Morbi porttitor lorem id ligula.",JPY,90.71
442,dui,Nulla suscipit ligula in lacus. Curabitur at ipsum ac tellus semper interdum. Mauris ullamcorper purus sit amet nulla.,BGN,27.29
443,nulla sed accumsan felis,"Aliquam augue quam, sollicitudin vitae, consectetuer eget, rutrum at, lorem. Integer tincidunt ante vel ipsum.",BMD,93.54
444,aliquet,Nam tristique tortor eu pede.,EUR,73.1
445,sed accumsan felis,"Donec odio justo, sollicitudin ut, suscipit a, feugiat et, eros. Vestibulum ac est lacinia nisi venenatis tristique.",IDR,18.6
446,lectus,"Nam congue, risus semper porta volutpat, quam pede lobortis ligula, sit amet eleifend pede libero quis orci.",CNY,70.35
447,etiam faucibus,Etiam pretium iaculis justo.,AOA,17.01
448,risus semper porta volutpat,"Quisque porta volutpat erat. Quisque erat eros, viverra eget, congue eget, semper rutrum, nulla.",CNY,8.55
449,eu pede,Maecenas tincidunt lacus at velit. Vivamus vel nulla eget eros elementum pellentesque. Quisque porta volutpat erat.,CNY,67.93
450,leo maecenas pulvinar lobortis,Proin interdum mauris non ligula pellentesque ultrices.,BRL,87.21
451,in faucibus orci,Morbi porttitor lorem id ligula.,UAH,42.06
452,mattis nibh ligula nec,"In hac habitasse platea dictumst. Aliquam augue quam, sollicitudin vitae, consectetuer eget, rutrum at, lorem. Integer tincidunt ante vel ipsum.",CNY,32.38
453,eget congue,Suspendisse potenti. Cras in purus eu magna vulputate luctus.,IDR,65.95
454,in faucibus orci,"Cum sociis natoque penatibus et magnis dis parturient montes, nascetur ridiculus mus.",EUR,41.66
455,quisque arcu libero rutrum,"Vivamus metus arcu, adipiscing molestie, hendrerit at, vulputate vitae, nisl. Aenean lectus.",CNY,34.95
456,vivamus,"Morbi vel lectus in quam fringilla rhoncus. Mauris enim leo, rhoncus sed, vestibulum sit amet, cursus id, turpis. Integer aliquet, massa id lobortis convallis, tortor risus dapibus augue, vel accumsan tellus nisi eu orci.",JPY,63.9
457,sem mauris,"Vestibulum quam sapien, varius ut, blandit non, interdum in, ante.",SEK,68.77
458,sapien,"Aliquam augue quam, sollicitudin vitae, consectetuer eget, rutrum at, lorem.",TZS,35.61
459,praesent,"Nam dui. Proin leo odio, porttitor id, consequat in, consequat ut, nulla.",CVE,54.97
460,suspendisse potenti in,Duis consequat dui nec nisi volutpat eleifend.,IDR,9.95
461,aliquet ultrices,Praesent id massa id nisl venenatis lacinia.,EUR,19.27
462,platea,Suspendisse potenti. Nullam porttitor lacus at turpis. Donec posuere metus vitae ipsum.,VND,64.36
