id,name,description,currency,amount
1,eget nunc,Curabitur in libero ut massa volutpat convallis.,PLN,78.9
2,lectus,Duis bibendum.,PLN,64.64
3,nisi venenatis tristique fusce,Donec vitae nisi.,UAH,48.45
4,massa donec,Praesent blandit lacinia erat. Vestibulum sed magna at nunc commodo placerat.,CNY,73.23
5,nulla tempus vivamus in,Aenean fermentum. Donec ut mauris eget massa tempor convallis.,EUR,65.48
6,integer ac,"Nam ultrices, libero non mattis pulvinar, nulla pede ullamcorper augue, a suscipit nulla elit ac nulla. Sed vel enim sit amet nunc viverra dapibus.",CNY,27.06
7,lobortis,"Maecenas tristique, est et tempus semper, est quam pharetra magna, ac consequat metus sapien ut nunc.",IDR,70.81
8,vestibulum velit id,"Vestibulum ante ipsum primis in faucibus orci luctus et ultrices posuere cubilia Curae; Donec pharetra, magna vestibulum aliquet ultrices, erat tortor sollicitudin mi, sit amet lobortis sapien sapien non mi.",CNY,75.07
9,ligula pellentesque ultrices phasellus,Duis at velit eu est congue elementum.,GHS,35.1
10,placerat ante nulla justo,Nullam sit amet turpis elementum ligula vehicula consequat. Morbi a ipsum. Integer a nibh.,NGN,4.05
11,in est risus,Pellentesque at nulla. Suspendisse potenti. Cras in purus eu magna vulputate luctus.,BRL,28.24
12,arcu sed augue aliquam,"Vivamus metus arcu, adipiscing molestie, hendrerit at, vulputate vitae, nisl.",AFN,63.2
13,sapien ut nunc vestibulum,Vestibulum ante ipsum primis in faucibus orci luctus et ultrices posuere cubilia Curae; Mauris viverra diam vitae quam. Suspendisse potenti.,HTG,42.94
14,non,Vivamus tortor. Duis mattis egestas metus.,SZL,89.74
15,at,Nulla justo. Aliquam quis turpis eget elit sodales scelerisque. Mauris sit amet eros.,CNY,50.91
16,mi nulla ac,Praesent lectus.,EUR,18.03
17,consequat varius,Etiam vel augue. Vestibulum rutrum rutrum neque.,EUR,78.22
18,nam ultrices libero non,Maecenas pulvinar lobortis est.,BAM,71.7
19,mauris non ligula,Suspendisse potenti.,RUB,73.03
20,magnis,"Donec semper sapien a libero. Nam dui. Proin leo odio, porttitor id, consequat in, consequat ut, nulla.",PHP,23.54
21,congue risus semper,Curabitur at ipsum ac tellus semper interdum.,CNY,22.21
22,eu,Curabitur gravida nisi at nibh.,CNY,63.66
23,odio consequat,Phasellus sit amet erat. Nulla tempus. Vivamus in felis eu sapien cursus vestibulum.,RUB,74.61
24,nulla pede ullamcorper augue,Nullam porttitor lacus at turpis.,USD,34.99
25,aliquam,Cras non velit nec nisi vulputate nonummy.,XAF,48.5
26,neque sapien placerat,Nulla ut erat id mauris vulputate elementum. Nullam varius. Nulla facilisi.,PHP,56.21
27,mattis pulvinar nulla,Suspendisse potenti. Nullam porttitor lacus at turpis.,EUR,87.8
28,pulvinar lobortis est,Pellentesque ultrices mattis odio. Donec vitae nisi.,EUR,29.54
29,vel nulla eget,Suspendisse potenti. In eleifend quam a odio.,CDF,23.06
30,quam suspendisse potenti,Vivamus in felis eu sapien cursus vestibulum. Proin eu mi.,HRK,73.85
31,massa donec,Quisque id justo sit amet sapien dignissim vestibulum. Vestibulum ante ipsum primis in faucibus orci luctus et ultrices posuere cubilia Curae; Nulla dapibus dolor vel est.,PLN,46.35
32,sed,"Proin interdum mauris non ligula pellentesque ultrices. Phasellus id sapien in sapien iaculis congue. Vivamus metus arcu, adipiscing molestie, hendrerit at, vulputate vitae, nisl.",CNY,43.26
33,ac,"Lorem ipsum dolor sit amet, consectetuer adipiscing elit.",IDR,61.74
34,aenean,"Maecenas tristique, est et tempus semper, est quam pharetra magna, ac consequat metus sapien ut nunc. Vestibulum ante ipsum primis in faucibus orci luctus et ultrices posuere cubilia Curae; Mauris viverra diam vitae quam. Suspendisse potenti.",CNY,30.11
35,amet,Duis mattis egestas metus. Aenean fermentum. Donec ut mauris eget massa tempor convallis.,MAD,68.93
36,turpis eget elit,Etiam faucibus cursus urna. Ut tellus. Nulla ut erat id mauris vulputate elementum.,IDR,37.06
37,euismod scelerisque,"Quisque erat eros, viverra eget, congue eget, semper rutrum, nulla. Nunc purus.",ILS,81.42
38,scelerisque,Cras in purus eu magna vulputate luctus.,EUR,39.64
39,erat vestibulum sed magna,Curabitur convallis. Duis consequat dui nec nisi volutpat eleifend. Donec ut dolor.,CDF,26.12
40,id massa,"Nulla ac enim. In tempor, turpis nec euismod scelerisque, quam turpis adipiscing lorem, vitae mattis nibh ligula nec sem.",PLN,11.2
41,tincidunt eu,Proin at turpis a pede posuere nonummy.,EUR,69.72
42,montes nascetur,Donec semper sapien a libero. Nam dui.,RUB,2.16
43,sed tristique in,Duis at velit eu est congue elementum. In hac habitasse platea dictumst.,PHP,55.96
44,vivamus vestibulum sagittis sapien,"Morbi odio odio, elementum eu, interdum eu, tincidunt in, leo.",UAH,71.48
45,sapien in sapien iaculis,Phasellus sit amet erat.,CNY,64.97
46,tortor id nulla ultrices,In quis justo. Maecenas rhoncus aliquam lacus.,CNY,79.69
47,erat fermentum,Etiam pretium iaculis justo. In hac habitasse platea dictumst.,PHP,20.54
48,pulvinar,"Duis bibendum, felis sed interdum venenatis, turpis enim blandit mi, in porttitor pede justo eu massa. Donec dapibus.",MKD,96.42
49,vel,Vivamus vel nulla eget eros elementum pellentesque.,IDR,50.25
50,varius integer ac,Aenean auctor gravida sem. Praesent id massa id nisl venenatis lacinia.,CNY,20.52
51,sapien,In eleifend quam a odio.,PLN,68.11
52,mi nulla ac enim,"Morbi odio odio, elementum eu, interdum eu, tincidunt in, leo. Maecenas pulvinar lobortis est.",IDR,26.39
53,velit,"Donec odio justo, sollicitudin ut, suscipit a, feugiat et, eros. Vestibulum ac est lacinia nisi venenatis tristique. Fusce congue, diam id ornare imperdiet, sapien urna pretium nisl, ut volutpat sapien arcu sed augue.",CNY,86.99
54,primis in faucibus orci,"Nullam orci pede, venenatis non, sodales sed, tincidunt eu, felis.",IDR,48.57
55,eget tempus,Vivamus vestibulum sagittis sapien.,CNY,90.26
56,auctor sed,"Quisque erat eros, viverra eget, congue eget, semper rutrum, nulla. Nunc purus. Phasellus in felis.",EUR,74.13
57,in,Pellentesque viverra pede ac diam. Cras pellentesque volutpat dui.,AZN,74.87
58,sem duis aliquam convallis,"Aenean sit amet justo. Morbi ut odio. Cras mi pede, malesuada in, imperdiet et, commodo vulputate, justo.",CNY,6.96
59,non,Donec dapibus.,CNY,37.28
60,justo in blandit,Curabitur gravida nisi at nibh.,BRL,67.74
61,in hac habitasse,Nunc purus. Phasellus in felis.,PHP,35.06
62,ipsum,Suspendisse potenti. Nullam porttitor lacus at turpis.,PEN,54.01
63,gravida,"Aliquam augue quam, sollicitudin vitae, consectetuer eget, rutrum at, lorem. Integer tincidunt ante vel ipsum.",PHP,14.34
64,eget nunc,"Vestibulum quam sapien, varius ut, blandit non, interdum in, ante.",SEK,38.74
65,pede,"Integer pede justo, lacinia eget, tincidunt eget, tempus vel, pede. Morbi porttitor lorem id ligula. Suspendisse ornare consequat lectus.",PHP,24.24
66,convallis,Quisque ut erat.,MYR,90.37
67,rutrum at lorem integer,Vivamus tortor. Duis mattis egestas metus.,IDR,83.11
68,habitasse platea dictumst aliquam,Proin eu mi.,YER,88.34
69,mi,Donec ut mauris eget massa tempor convallis.,MAD,27.27
70,condimentum id,"In hac habitasse platea dictumst. Morbi vestibulum, velit id pretium iaculis, diam erat fermentum justo, nec condimentum neque sapien placerat ante.",AFN,24.07
71,cursus,Integer tincidunt ante vel ipsum. Praesent blandit lacinia erat.,HRK,85.03
72,vestibulum vestibulum,"Maecenas tristique, est et tempus semper, est quam pharetra magna, ac consequat metus sapien ut nunc. Vestibulum ante ipsum primis in faucibus orci luctus et ultrices posuere cubilia Curae; Mauris viverra diam vitae quam.",PHP,49.24
73,mi in,Integer a nibh. In quis justo.,IDR,86.54
74,libero non,In hac habitasse platea dictumst. Maecenas ut massa quis augue luctus tincidunt. Nulla mollis molestie lorem.,EUR,9.97
75,sapien iaculis,Morbi porttitor lorem id ligula.,COP,89.89
76,felis fusce posuere felis,Mauris lacinia sapien quis libero. Nullam sit amet turpis elementum ligula vehicula consequat. Morbi a ipsum.,RUB,61.63
77,lorem ipsum,Aenean lectus. Pellentesque eget nunc. Donec quis orci eget orci vehicula condimentum.,USD,15.25
78,donec,Aenean auctor gravida sem.,BRL,76.16
79,mi pede malesuada,Sed ante. Vivamus tortor.,CNY,45.17
80,justo pellentesque viverra pede,Duis bibendum. Morbi non quam nec dui luctus rutrum. Nulla tellus.,RUB,2.51
81,nulla neque libero,Curabitur in libero ut massa volutpat convallis.,COP,32.1
82,id nulla ultrices aliquet,Quisque ut erat.,MUR,3.03
83,lacus curabitur at,"Nam nulla. Integer pede justo, lacinia eget, tincidunt eget, tempus vel, pede. Morbi porttitor lorem id ligula.",EUR,37.92
84,sagittis sapien,Nullam sit amet turpis elementum ligula vehicula consequat.,CNY,56.03
85,vel lectus,Morbi quis tortor id nulla ultrices aliquet.,IDR,66.91
86,luctus rutrum nulla,Phasellus in felis.,CNY,27.18
87,consequat,Aenean auctor gravida sem.,EUR,52.33
88,suspendisse potenti in eleifend,Fusce consequat. Nulla nisl. Nunc nisl.,CNY,23.97
89,nec nisi,In hac habitasse platea dictumst. Etiam faucibus cursus urna.,CNY,33.53
90,sodales scelerisque,"Curabitur in libero ut massa volutpat convallis. Morbi odio odio, elementum eu, interdum eu, tincidunt in, leo. Maecenas pulvinar lobortis est.",LKR,72.6
91,ut rhoncus,"Proin leo odio, porttitor id, consequat in, consequat ut, nulla. Sed accumsan felis.",CNY,27.11
92,eu,In hac habitasse platea dictumst.,CNY,7.89
93,hac,Donec semper sapien a libero.,UAH,15.14
94,leo pellentesque ultrices mattis,"Praesent blandit. Nam nulla. Integer pede justo, lacinia eget, tincidunt eget, tempus vel, pede.",CNY,17.24
95,tempus vivamus in,"Morbi vestibulum, velit id pretium iaculis, diam erat fermentum justo, nec condimentum neque sapien placerat ante. Nulla justo. Aliquam quis turpis eget elit sodales scelerisque.",BYR,72.11
96,placerat,Duis aliquam convallis nunc. Proin at turpis a pede posuere nonummy. Integer non velit.,CNY,26.56
97,sit,Etiam pretium iaculis justo.,UAH,19.28
98,quam sapien,Aliquam quis turpis eget elit sodales scelerisque.,BRL,5.46
99,interdum,Mauris sit amet eros. Suspendisse accumsan tortor quis turpis.,CNY,29.54
100,et ultrices,Donec ut dolor. Morbi vel lectus in quam fringilla rhoncus.,PLN,41.17
101,nec,Integer a nibh. In quis justo. Maecenas rhoncus aliquam lacus.,LKR,46.2
102,justo morbi,"Donec odio justo, sollicitudin ut, suscipit a, feugiat et, eros. Vestibulum ac est lacinia nisi venenatis tristique. Fusce congue, diam id ornare imperdiet, sapien urna pretium nisl, ut volutpat sapien arcu sed augue.",RUB,92.12
103,diam cras pellentesque volutpat,"Cum sociis natoque penatibus et magnis dis parturient montes, nascetur ridiculus mus. Vivamus vestibulum sagittis sapien.",PLN,97.56
104,luctus et,"Morbi odio odio, elementum eu, interdum eu, tincidunt in, leo.",THB,19.12
105,rhoncus aliquam lacus morbi,"Nunc nisl. Duis bibendum, felis sed interdum venenatis, turpis enim blandit mi, in porttitor pede justo eu massa.",BGN,9.71
106,aenean,Vivamus vestibulum sagittis sapien.,PHP,60.57
107,nascetur,Aliquam erat volutpat. In congue.,RUB,3.53
108,dolor,"Nunc rhoncus dui vel sem. Sed sagittis. Nam congue, risus semper porta volutpat, quam pede lobortis ligula, sit amet eleifend pede libero quis orci.",THB,1.43
109,cum sociis natoque,"Integer non velit. Donec diam neque, vestibulum eget, vulputate ut, ultrices vel, augue.",CNY,49.57
110,felis,Sed vel enim sit amet nunc viverra dapibus. Nulla suscipit ligula in lacus.,RUB,97.74
111,quisque id justo sit,"Proin leo odio, porttitor id, consequat in, consequat ut, nulla.",IDR,81.14
112,dapibus dolor vel,"In sagittis dui vel nisl. Duis ac nibh. Fusce lacus purus, aliquet at, feugiat non, pretium quis, lectus.",IDR,11.57
113,libero convallis,Morbi non quam nec dui luctus rutrum. Nulla tellus. In sagittis dui vel nisl.,USD,41.87
114,pede venenatis non sodales,"Morbi vestibulum, velit id pretium iaculis, diam erat fermentum justo, nec condimentum neque sapien placerat ante. Nulla justo.",CNY,28.28
115,sociis,Nullam sit amet turpis elementum ligula vehicula consequat. Morbi a ipsum.,PKR,67.02
116,eu magna vulputate luctus,"Quisque arcu libero, rutrum ac, lobortis vel, dapibus at, diam.",CNY,96.38
117,nulla tempus,Proin eu mi. Nulla ac enim.,EUR,67.41
118,pede ac,Curabitur at ipsum ac tellus semper interdum.,EUR,1.77
119,posuere felis,Aliquam quis turpis eget elit sodales scelerisque. Mauris sit amet eros. Suspendisse accumsan tortor quis turpis.,PHP,68.11
120,cursus urna ut,"Nam dui. Proin leo odio, porttitor id, consequat in, consequat ut, nulla. Sed accumsan felis.",CNY,78.57
121,quis tortor,Vestibulum ante ipsum primis in faucibus orci luctus et ultrices posuere cubilia Curae; Mauris viverra diam vitae quam.,IDR,39.7
122,porttitor lorem id ligula,Donec vitae nisi.,SEK,76.57
123,at nunc commodo placerat,Morbi quis tortor id nulla ultrices aliquet.,BDT,63.66
124,posuere cubilia,Suspendisse potenti.,PLN,41.62
125,vulputate,Duis mattis egestas metus. Aenean fermentum. Donec ut mauris eget massa tempor convallis.,CNY,62.37
126,sapien,"Quisque arcu libero, rutrum ac, lobortis vel, dapibus at, diam. Nam tristique tortor eu pede.",CNY,66.58
127,nulla tempus vivamus in,"Mauris ullamcorper purus sit amet nulla. Quisque arcu libero, rutrum ac, lobortis vel, dapibus at, diam.",UAH,39.71
128,convallis,"Phasellus id sapien in sapien iaculis congue. Vivamus metus arcu, adipiscing molestie, hendrerit at, vulputate vitae, nisl. Aenean lectus.",GBP,25.3
129,vitae mattis,"In hac habitasse platea dictumst. Morbi vestibulum, velit id pretium iaculis, diam erat fermentum justo, nec condimentum neque sapien placerat ante. Nulla justo.",EUR,25.88
130,nulla nisl nunc nisl,Donec dapibus. Duis at velit eu est congue elementum.,TZS,16.93
131,sed justo pellentesque,"Vestibulum quam sapien, varius ut, blandit non, interdum in, ante. Vestibulum ante ipsum primis in faucibus orci luctus et ultrices posuere cubilia Curae; Duis faucibus accumsan odio.",MXN,91.59
132,sed magna at,"Nullam orci pede, venenatis non, sodales sed, tincidunt eu, felis. Fusce posuere felis sed lacus.",SEK,27.15
133,lacinia aenean,"Donec diam neque, vestibulum eget, vulputate ut, ultrices vel, augue. Vestibulum ante ipsum primis in faucibus orci luctus et ultrices posuere cubilia Curae; Donec pharetra, magna vestibulum aliquet ultrices, erat tortor sollicitudin mi, sit amet lobortis sapien sapien non mi. Integer ac neque.",CNY,33.62
134,dui proin leo odio,Maecenas tincidunt lacus at velit.,CAD,98.21
135,convallis morbi odio odio,Phasellus in felis. Donec semper sapien a libero. Nam dui.,PHP,60.89
136,habitasse platea dictumst,"Nam congue, risus semper porta volutpat, quam pede lobortis ligula, sit amet eleifend pede libero quis orci.",MNT,38.81
137,blandit mi,Duis bibendum.,JMD,65.45
138,ut erat curabitur gravida,Donec ut dolor.,CAD,42.68
139,neque,"Nulla nisl. Nunc nisl. Duis bibendum, felis sed interdum venenatis, turpis enim blandit mi, in porttitor pede justo eu massa.",CNY,54.55
140,scelerisque mauris,Vestibulum ante ipsum primis in faucibus orci luctus et ultrices posuere cubilia Curae; Duis faucibus accumsan odio. Curabitur convallis.,ZAR,72.97
141,convallis,"Nunc rhoncus dui vel sem. Sed sagittis. Nam congue, risus semper porta volutpat, quam pede lobortis ligula, sit amet eleifend pede libero quis orci.",CNY,56.58
142,sit amet eros suspendisse,"Morbi ut odio. Cras mi pede, malesuada in, imperdiet et, commodo vulputate, justo.",CNY,37.67
143,pellentesque ultrices mattis,Morbi non lectus.,IDR,23.16
144,aenean auctor,"Praesent lectus. Vestibulum quam sapien, varius ut, blandit non, interdum in, ante. Vestibulum ante ipsum primis in faucibus orci luctus et ultrices posuere cubilia Curae; Duis faucibus accumsan odio.",PEN,40.18
145,vestibulum sit amet,"Cras in purus eu magna vulputate luctus. Cum sociis natoque penatibus et magnis dis parturient montes, nascetur ridiculus mus.",CNY,89.73
146,donec ut mauris,Aenean fermentum.,ISK,45.19
147,nunc vestibulum,Praesent lectus.,IDR,21.16
148,elementum,Morbi vel lectus in quam fringilla rhoncus.,EUR,55.37
149,placerat,"Quisque erat eros, viverra eget, congue eget, semper rutrum, nulla.",BRL,7.4
150,vitae,"Vestibulum ante ipsum primis in faucibus orci luctus et ultrices posuere cubilia Curae; Donec pharetra, magna vestibulum aliquet ultrices, erat tortor sollicitudin mi, sit amet lobortis sapien sapien non mi. Integer ac neque. Duis bibendum.",USD,25.92
151,malesuada in imperdiet,"Quisque id justo sit amet sapien dignissim vestibulum. Vestibulum ante ipsum primis in faucibus orci luctus et ultrices posuere cubilia Curae; Nulla dapibus dolor vel est. Donec odio justo, sollicitudin ut, suscipit a, feugiat et, eros.",CNY,93.72
152,nulla dapibus dolor,Praesent blandit lacinia erat. Vestibulum sed magna at nunc commodo placerat. Praesent blandit.,RUB,62.19
153,posuere cubilia,Morbi quis tortor id nulla ultrices aliquet.,CNY,44.72
154,id turpis integer,"Fusce lacus purus, aliquet at, feugiat non, pretium quis, lectus.",CNY,24.63
155,amet justo morbi ut,"Quisque erat eros, viverra eget, congue eget, semper rutrum, nulla.",RUB,23.94
156,felis,"Curabitur at ipsum ac tellus semper interdum. Mauris ullamcorper purus sit amet nulla. Quisque arcu libero, rutrum ac, lobortis vel, dapibus at, diam.",SEK,44.82
157,sapien cum sociis,"Aliquam sit amet diam in magna bibendum imperdiet. Nullam orci pede, venenatis non, sodales sed, tincidunt eu, felis. Fusce posuere felis sed lacus.",TZS,73.11
158,eget semper rutrum nulla,"Vestibulum ac est lacinia nisi venenatis tristique. Fusce congue, diam id ornare imperdiet, sapien urna pretium nisl, ut volutpat sapien arcu sed augue.",BRL,45.8
159,faucibus,"Aliquam sit amet diam in magna bibendum imperdiet. Nullam orci pede, venenatis non, sodales sed, tincidunt eu, felis.",VND,37.19
160,pede ullamcorper augue,Morbi ut odio.,PHP,40.43
161,vitae,Nunc nisl.,CNY,32.27
162,venenatis turpis enim,Morbi vel lectus in quam fringilla rhoncus.,PHP,68.74
163,eu mi nulla,Nunc rhoncus dui vel sem. Sed sagittis.,USD,26.94
164,varius integer ac leo,"Integer aliquet, massa id lobortis convallis, tortor risus dapibus augue, vel accumsan tellus nisi eu orci. Mauris lacinia sapien quis libero.",VEF,80.99
165,lectus suspendisse potenti in,In hac habitasse platea dictumst.,IRR,80.26
166,eget semper rutrum nulla,Pellentesque eget nunc. Donec quis orci eget orci vehicula condimentum. Curabitur in libero ut massa volutpat convallis.,CNY,75.19
167,accumsan tellus nisi,Nulla mollis molestie lorem. Quisque ut erat. Curabitur gravida nisi at nibh.,IDR,40.06
168,curabitur convallis duis consequat,Fusce consequat. Nulla nisl. Nunc nisl.,BRL,60.26
169,lectus suspendisse,Morbi vel lectus in quam fringilla rhoncus.,PHP,27.76
170,augue,Etiam justo. Etiam pretium iaculis justo. In hac habitasse platea dictumst.,BRL,81.1
171,aliquam lacus morbi,Aliquam erat volutpat. In congue.,CAD,14.22
172,in lacus curabitur at,Aliquam sit amet diam in magna bibendum imperdiet.,NOK,7.81
173,varius,Donec semper sapien a libero.,IDR,52.25
174,elit sodales scelerisque mauris,Phasellus sit amet erat. Nulla tempus. Vivamus in felis eu sapien cursus vestibulum.,BAM,60.71
175,enim in,Nulla nisl. Nunc nisl.,PHP,28.46
176,bibendum morbi non quam,Donec posuere metus vitae ipsum. Aliquam non mauris.,CNY,62.56
177,est risus,Maecenas ut massa quis augue luctus tincidunt. Nulla mollis molestie lorem. Quisque ut erat.,CNY,68.62
178,dui luctus rutrum nulla,Nunc purus.,CNY,45.37
179,interdum venenatis turpis enim,Sed accumsan felis.,COP,15.94
180,rutrum,Duis at velit eu est congue elementum.,EUR,8.55
181,nec,"Morbi vestibulum, velit id pretium iaculis, diam erat fermentum justo, nec condimentum neque sapien placerat ante. Nulla justo.",USD,19.58
182,orci luctus et,Nulla ut erat id mauris vulputate elementum. Nullam varius. Nulla facilisi.,EUR,13.71
183,posuere cubilia,In hac habitasse platea dictumst.,IDR,42.53
184,nulla dapibus,Sed ante. Vivamus tortor.,NGN,75.92
185,aliquet pulvinar,"Nam ultrices, libero non mattis pulvinar, nulla pede ullamcorper augue, a suscipit nulla elit ac nulla. Sed vel enim sit amet nunc viverra dapibus. Nulla suscipit ligula in lacus.",CZK,22.92
186,dapibus nulla suscipit,Donec ut dolor.,TZS,71.38
187,sagittis sapien cum sociis,Nulla tellus. In sagittis dui vel nisl.,KZT,41.49
188,nascetur ridiculus mus etiam,"Phasellus id sapien in sapien iaculis congue. Vivamus metus arcu, adipiscing molestie, hendrerit at, vulputate vitae, nisl. Aenean lectus.",SEK,25.77
189,curabitur at ipsum ac,"Integer non velit. Donec diam neque, vestibulum eget, vulputate ut, ultrices vel, augue.",THB,48.72
190,sagittis,"Integer pede justo, lacinia eget, tincidunt eget, tempus vel, pede.",RSD,74.23
191,accumsan felis ut,"Quisque erat eros, viverra eget, congue eget, semper rutrum, nulla. Nunc purus. Phasellus in felis.",CNY,22.36
192,lacus,Maecenas tincidunt lacus at velit.,PLN,89.34
193,ultrices phasellus id,"In est risus, auctor sed, tristique in, tempus sit amet, sem. Fusce consequat.",MGA,45.49
194,consectetuer eget rutrum,In quis justo. Maecenas rhoncus aliquam lacus. Morbi quis tortor id nulla ultrices aliquet.,RUB,95.19
195,molestie nibh,"Fusce posuere felis sed lacus. Morbi sem mauris, laoreet ut, rhoncus aliquet, pulvinar sed, nisl.",GEL,42.69
196,dui luctus rutrum,Fusce posuere felis sed lacus.,COP,38.8
197,magnis dis parturient,Donec vitae nisi.,CNY,77.16
198,ante vestibulum,"Morbi odio odio, elementum eu, interdum eu, tincidunt in, leo. Maecenas pulvinar lobortis est. Phasellus sit amet erat.",BRL,45.4
199,congue elementum in,Nullam porttitor lacus at turpis.,BRL,58.87
200,tortor duis mattis,Sed accumsan felis.,SEK,71.42
201,sapien iaculis,Aenean sit amet justo.,PHP,86.84
202,nullam varius,Vivamus tortor.,IDR,54.32
203,nunc commodo placerat praesent,Duis bibendum.,MGA,24.16
204,integer aliquet,"Lorem ipsum dolor sit amet, consectetuer adipiscing elit. Proin interdum mauris non ligula pellentesque ultrices.",CNY,96.27
205,donec semper sapien,Vestibulum ante ipsum primis in faucibus orci luctus et ultrices posuere cubilia Curae; Nulla dapibus dolor vel est.,NGN,44.61
206,sed nisl nunc rhoncus,"Nullam orci pede, venenatis non, sodales sed, tincidunt eu, felis.",CHF,4.44
207,natoque penatibus,Pellentesque ultrices mattis odio. Donec vitae nisi.,RUB,51.86
208,integer ac,Nulla ut erat id mauris vulputate elementum. Nullam varius.,CNY,29.83
209,adipiscing lorem vitae,"Aliquam augue quam, sollicitudin vitae, consectetuer eget, rutrum at, lorem.",IDR,3.51
210,eleifend quam,Integer non velit.,PLN,19.42
211,at,"Integer pede justo, lacinia eget, tincidunt eget, tempus vel, pede.",EUR,67.87
212,sem,"Maecenas leo odio, condimentum id, luctus nec, molestie sed, justo. Pellentesque viverra pede ac diam.",CNY,11.23
213,faucibus cursus urna ut,Phasellus in felis.,ALL,45.79
214,viverra diam vitae,Aliquam quis turpis eget elit sodales scelerisque.,USD,8.99
215,magnis,Pellentesque eget nunc. Donec quis orci eget orci vehicula condimentum. Curabitur in libero ut massa volutpat convallis.,CAD,94.72
216,mauris eget massa tempor,"Cras in purus eu magna vulputate luctus. Cum sociis natoque penatibus et magnis dis parturient montes, nascetur ridiculus mus.",CNY,17.02
217,dolor quis odio,"In sagittis dui vel nisl. Duis ac nibh. Fusce lacus purus, aliquet at, feugiat non, pretium quis, lectus.",RUB,12.21
218,sapien cursus vestibulum proin,Etiam faucibus cursus urna. Ut tellus.,CNY,13.09
219,ut,"Mauris enim leo, rhoncus sed, vestibulum sit amet, cursus id, turpis. Integer aliquet, massa id lobortis convallis, tortor risus dapibus augue, vel accumsan tellus nisi eu orci. Mauris lacinia sapien quis libero.",USD,55.76
220,eget vulputate,"Phasellus id sapien in sapien iaculis congue. Vivamus metus arcu, adipiscing molestie, hendrerit at, vulputate vitae, nisl.",MDL,76.48
221,et magnis dis parturient,Vestibulum sed magna at nunc commodo placerat. Praesent blandit. Nam nulla.,CAD,93.46
222,nulla sed,"Morbi odio odio, elementum eu, interdum eu, tincidunt in, leo. Maecenas pulvinar lobortis est. Phasellus sit amet erat.",RUB,69.17
223,rhoncus sed,"Lorem ipsum dolor sit amet, consectetuer adipiscing elit. Proin interdum mauris non ligula pellentesque ultrices.",TND,60.16
224,sit amet erat nulla,"Suspendisse potenti. Cras in purus eu magna vulputate luctus. Cum sociis natoque penatibus et magnis dis parturient montes, nascetur ridiculus mus.",PLN,3.83
225,lacus,"Nulla neque libero, convallis eget, eleifend luctus, ultricies eu, nibh.",RUB,30.44
226,eros,"Nam ultrices, libero non mattis pulvinar, nulla pede ullamcorper augue, a suscipit nulla elit ac nulla.",EUR,99.81
227,ultrices enim,Aenean fermentum. Donec ut mauris eget massa tempor convallis.,COP,23.74
228,neque sapien placerat ante,"Fusce posuere felis sed lacus. Morbi sem mauris, laoreet ut, rhoncus aliquet, pulvinar sed, nisl. Nunc rhoncus dui vel sem.",CNY,72.39
229,morbi,Duis aliquam convallis nunc. Proin at turpis a pede posuere nonummy.,EUR,14.27
230,sit amet erat,"Phasellus id sapien in sapien iaculis congue. Vivamus metus arcu, adipiscing molestie, hendrerit at, vulputate vitae, nisl.",MNT,73.39
231,ut volutpat sapien,Ut at dolor quis odio consequat varius. Integer ac leo.,SEK,10.85
232,fermentum,Pellentesque ultrices mattis odio.,IDR,71.5
233,sit amet lobortis sapien,In eleifend quam a odio. In hac habitasse platea dictumst. Maecenas ut massa quis augue luctus tincidunt.,PKR,46.63
234,cursus id,Cras non velit nec nisi vulputate nonummy. Maecenas tincidunt lacus at velit. Vivamus vel nulla eget eros elementum pellentesque.,THB,91.68
235,dolor sit,Pellentesque at nulla. Suspendisse potenti.,CNY,82.68
236,non,"Curabitur at ipsum ac tellus semper interdum. Mauris ullamcorper purus sit amet nulla. Quisque arcu libero, rutrum ac, lobortis vel, dapibus at, diam.",CNY,13.81
237,augue,Donec semper sapien a libero.,CNY,77.12
238,rutrum nulla,Suspendisse potenti. Nullam porttitor lacus at turpis. Donec posuere metus vitae ipsum.,EUR,94.77
239,mi sit amet,Vivamus in felis eu sapien cursus vestibulum. Proin eu mi.,CNY,40.63
